{
  "contract_id": "0209-25",
  "company_name": "WEBNORUS LIMITED",
  "filename": "WEBNORUS_LIMITED_contract",
  "markdown": "```markdown\n# PAYMENT MANAGEMENT SERVICES AGREEMENT NO 0209-25\n\n---\n\n**THE PAYMENT MANAGEMENT SERVICES AGREEMENT NO 0209-25** (hereinafter - Agreement) is entered into as of 2d September 2025 (the \"Effective Date\") by and between:\n\n**WEBNORUS LIMITED**, a legal entity duly established and acting under the laws of the United Kingdom, with the registered number 15668312, and registered address is 33 St. Leonards Road, Hull, England, HU5 1BE, represented by the Director **Vitalijs LOMAKO** acted on the basis of the Article of Association (hereinafter referred to as \"Merchant\"), and\n\n**SMARTFLOW PAYMENTS LIMITED**, a legal entity duly established and acting under the laws of England and Wales with the registered number 11070048, registered office is at: Office 39.18 Level39 One Canada Square, London, England, E14 5AB, represented by the Director **Anastasiia Pervushyna** acted on the basis of the Article of Association (hereinafter referred to as the \"Company\")\n\nThe Merchant and the Company are hereinafter sometimes referred to individually as the \"Party\" and together collectively as the \"Parties\".\n\nThe Company and the Merchant hereby agree that the following updated terms and conditions, and those set forth in Terms of Business Agreement attached hereto, shall be binding upon the Parties.\n\n---\n\n## RECITALS:\n\nWHEREAS, the Merchant would like to obtain the Company Services to facilitate payments by the Merchant's Consumers which may purchase and utilise various interactive content, virtual goods and/or services of the Merchant; and\n\nWHEREAS, the Company operates the payment processing platform designated to collect payments (Internet Acquiring, with the use of electronic means of payment) from Consumers for various interactive content, virtual goods and/or services (the \"Company Platform\"), and\n\nWHEREAS, the Merchant wishes to mandate and instruct the Company to provide payment collection services (hereinafter - Services) for the payments made by the Customers (as defined below) for the Merchant Services (as defined below), and the Company wishes to render such Services in good faith under the terms set forth herein;\n\nNOW, THEREFORE, in consideration of the promises, conditions, covenants, and warranties herein contained, the Parties agree as follows:\n\n---\n\n## 1. DEFINITIONS\n\n1.1. \"3-D Secure\" is a protocol for authentication of the Cardholders during Payment Transactions with EMI approved by Visa and MasterCard, which allows to minimise the risk of EMI fraud.\n\n1.2. \"Acquiring\" means the performance of payment transactions, which consists in accepting EMI, resulting in the transfer of funds to the Merchant, using the Virtual Payment Terminal.\n\n1.3. \"Authorisation\" shall mean the procedure for obtaining permission to conduct a transaction using electronic means.\n\n1.4. \"Business Day\" shall mean a day other than a Saturday or Sunday and not being a public holiday, and on which banks are open for business either in the country of incorporation of the Merchant (for the purpose of definition of time for obligations and other performances to be executed by the Merchant) or in the country of incorporation of the Company (for the purpose of definition of time for obligations and any other performances to be executed by the Company).\n\n1.5. \"Chargeback\" shall mean the return of funds to the Customer, forcibly initiated by the Issuing Bank under the instruction of the Customer due to errors or Fraud (as defined below). A refund transaction under a Disputed Transaction initiated by the Issuer on behalf of the EMI Holder or the Payment System, as a result of which the amount previously debited from the Issuer upon execution of a Payment Transaction using the Virtual Payment Terminal is refunded to the Issuer by the Acquirer.\n\n1.6. \"Company Fee\" shall mean the compensation that the Company charges Merchant for the services under this Agreement, as specified in Exhibit A.\n\n1.7. \"Confidential Information\" means information owned or legally possessed by a Party to the Agreement, contained on a material medium, which is marked \"confidential\" or when transferring the information to the other Party transmitting the Party has explicitly stated the confidentiality of such information, and which has limited access.\n\n1.8. \"Customer\" shall mean the end-user, subscriber, purchaser, or other natural person or entity that may potentially use the Company Platform to pay for the Merchant Services.\n\n1.9. \"Disputed Transaction\" means a transaction for which a claim has been received from the EMI Holder, Issuer or Payment Service Provider regarding disagreement with the fact of debiting, the amount of the Payment Transaction, etc.\n\n1.10. \"Fraud\" shall mean theft and fraud committed using a credit card or any similar payment mechanism as a fraudulent source of funds in a transaction, such as unauthorised use of a card as alleged by the cardholder.\n\n1.11. \"Fraudulent Transaction\" means a Payment Transaction performed using a lost/stolen/forged EMI, its duplicate or using information about its details required for the Payment Transaction and used without the permission of the EMI Holder. A Payment Transaction made using an EMI shall be deemed fraudulent by the decision of the Payment System and/or the Issuer.\n\n1.12. \"Electronic Payment Instrument (EMI)\" - is a payment instrument implemented on any medium (in the form of an issued (issued) plastic or other type of card (on a tangible medium or in the form of a virtual card), which contains in electronic form the data necessary to initiate a payment transaction and/or perform other transactions specified in the agreement with the Issuer. Under this Agreement payment refers to bank cards VISA, MasterCard.\n\n1.13. \"Invalid Transaction\" means a Payment Transaction that is recognised by the Bank as invalid after verification of the circumstances of such Payment Transaction on the basis of the PS Rules, taking into account the explanations and documents provided by the Merchant regarding such Payment Transaction, and has one of the following features:\n\n- the transaction was carried out and/or executed in violation of the terms of the SAR Rules or this Agreement;\n\n- use or attempted use of an EMI in someone else's name is detected (there is information that the legal EMI Holder did not participate in the Payment Transaction);\n\n- a forgery of a document under a Payment Transaction with the use of an EMI is detected;\n\n- the Authorisation Code has not been received or received from another Acquirer prior to the Payment Transaction;\n\n- The EMI Holder disputes the transactions performed using the EMI, and the Merchant is unable to provide documents confirming the successful provision of goods/services to the EMI Holder. Such confirmation may include in case of payment for the Goods provided electronically - registration data of the user of the Merchant's Website(s), IP address of the equipment from which the payment was made, mobile phone number in case of payment for the service from a mobile phone, receipt/account number (account ID) of the Merchant and other data, confirming the provision of the Goods to the EMI Holder, and in case of payment for physical goods and/or services - a copy of the receipt and/or check confirming the provision of the Goods to the EMI Holder and containing the date, time of provision/receipt of the Goods, cost, currency, masked EMI number, name and personal signature of the EMI Holder, etc.\n\n1.14. \"IPS\" means the international payment system Visa or MasterCard.\n\n1.15. \"Issuer\" means a legal entity that is an active participant of IPS/NPS, authorised to issue EMI and has issued (has issued) EMI.\n\n1.16. \"Merchant of Record\" or \"MOR\" means the entity that receives the proceeds from the Customer when an order is settled, and is ultimately responsible for the financial transaction.\n\n1.17. \"Merchant Services\" shall mean any services, content, virtual goods, and/or items offered, made available at, or otherwise enabled by the Merchant at the Merchant Sites (as defined below) to the Customer in exchange for the monetary or other valuable consideration, mobile commerce.\n\n1.18. Rolling Reserve shall mean predetermined percentage of the Customer's total turnover, held in a non-interest-bearing account (whether separate or aggregated) for a specified duration before being released to the Customer. The Rolling Reserve is designed to cover potential losses, expenses, damages, assessments, fees, charges, penalties, sanctions, fines, interest, etc., that may occur during the execution of this Agreement due to violations of this Agreement, other relevant agreements, applicable laws and regulations, Rules of the International Payment Systems, Rules of the APM Systems, or any other applicable guidelines. The Rolling Reserve is detailed and calculated as per the stipulations in the Fee Schedule section. The Parties hereby agree that the Rolling Reserve is a financial collateral (the \"Financial Collateral\") in the meaning of the Applicable Law and applies to the monetary funds, Virtual Currencies and their improvements, civil legal increments and fruits on accounts of the Customer secured for the benefit of the Provider that secure discharge of obligations of the Customer under the Agreement.\n\n1.19. \"EMI Holder\" means an individual who legally uses the EMI to initiate a payment transaction and/or perform other transactions specified in the agreement with the Issuer.\n\n1.20. \"Technology\" shall mean the software application programming interface (API) and proprietary process information provided by the Company pursuant to this Agreement.\n\n1.21. \"Term\" shall mean the period of time as set out in Section 8.1.\n\n1.22. Terms of Business Agreement shall mean the Addendum to the Agreement and shall constitute the integral part of herein;\n\n1.23. \"Territory\" shall strictly mean the specific countries identified in TERMS OF BUSINESS AGREEMENT.\n\n1.24. \"Trade Secrets\" means information related to the production, technology, management, financial and other activities of the Company, the disclosure of which may harm its interests.\n\n1.25. \"Virtual Payment Terminal\" means software that allows payment and other transactions using the details of the EMI on the Internet.\n\n1.26. In this Agreement, unless the contrary intention appears:\n\n1.25.1. Any references, express or implied, to statutes or statutory provisions shall be construed as references to those statutes or provisions as respectively amended or re-enacted or as their application has been modified by other provisions (whether before or after the date hereof) and shall include any orders, regulations, instruments or other subordinate legislation under the relevant statute or statutory provision.\n\n1.25.2. References to Sections, Clauses, Schedules, Addendum or Annexure and Exhibits are to Sections, Clauses in and to Schedules and Exhibits to this Agreement (unless the context otherwise requires).\n\n1.25.3. Headings are inserted for convenience only and shall not affect the construction of this Agreement.\n\n1.25.4. References to persons shall be deemed to include individuals, companies and other bodies corporate, unincorporated associations, societies, firms and public bodies, governments, states and any other entity (whether or not a separate legal entity).\n\n1.25.5. A reference to any gender is deemed to include a reference to any other gender. The singular is considered to include the plural and vice versa.\n\n---\n\n## 2. SUBJECT MATTER\n\n2.1. In exchange for the Fees set forth in Addendum \"Terms of Business Agreement\" withheld by the Company for its Services from Transaction Amounts, the Company provides payment processing services to the Merchant. At a minimum, the Company Services shall include:\n\na) enabling Transactions to be routed to the relevant International Payment System through Acquirer;\n\nb) enabling Merchant with access to the Company Platform to obtain real-time information about Transactions as well Fees, Chargebacks, Refunds, disputes, etc.; generation of Settlement Reports for each Settlement period enabling the Parties to do reconciliation of their accounts;\n\nc) providing information and messaging (immediate callbacks) about the status of each Transaction, including authorization status, Chargeback dispute status, etc.;\n\nd) provision of access to Company's Payment Gateway and processing of transactions through it;\n\ne) settlement of Transactions to the Merchant's Current Account;\n\nf) safeguarding of the funds in accordance with current legislation;\n\ng) fraud, anti-money laundering and risk management;\n\nh) technical integration support by the Company;\n\ni) technical maintenance of the Company's Platform in order to ensure continuous provision of Services;\n\nj) any other Services necessary for the Company to successfully perform this Agreement.\n\n2.2. The transfer of funds by the Company to the Merchant under the Payment Transaction shall not be considered as the fact of the Company's recognition of the legitimacy of such Payment Transaction if, as a result of an investigation by law enforcement agencies or Payment Systems, it is established that the Payment Transaction is an Invalid Transaction.\n\n2.3. Addendum \"Terms of Business Agreement\", which details the Fees, is hereby incorporated by reference and forms an integral part of this Agreement. Any amendments or updates to Addendum \"Terms of Business Agreement\" shall be communicated in writing and shall also be considered an integral part of this Agreement.\n\n---\n\n## 3. CHARGEBACKS\n\n3.1. The Merchant bears responsibility and the costs associated with the Chargebacks. The Merchant must carefully track and manage the Chargebacks and take steps to avoid future Chargebacks.\n\n---\n\n## 4. RIGHTS AND OBLIGATIONS OF THE MERCHANT\n\n4.1. The Merchant shall:\n\n4.1.1. to comply and guarantee that its product always complies with all the rules of the company, rules of International Payment Systems, technical requirements established by International Payment Systems and the Company, as well as PCI DSS standards, as each can change from time to time;\n\n4.1.2. to comply with all laws and regulations, including those relating to anti-money laundering and anti-terrorism, and to notify the Company and relevant government regulatory authorities of any Transaction or other matter related to Merchants that it considers suspicious;\n\n4.1.3. be solely responsible for the payment of all applicable taxes, duties, and other governmental charges (including any penalties, interest, and other additions thereto) that may be imposed on the Merchant in connection with the services provided under this Agreement. The Merchant shall ensure that all taxes due are paid to the appropriate tax authorities in a timely manner;\n\n4.1.4. to indemnify, defend, and hold harmless the Company from and against any and all liabilities, claims, demands, actions, costs, expenses, damages, and losses (including reasonable legal fees) arising out of or in connection with the Merchant's tax obligations and liabilities;\n\n4.1.5. to inform the Company regarding new service providers. The Company has the right to ask KYC set of documents of the new service provider for further approval;\n\n4.1.6. to keep the Trade Secrets, that became known to the Merchant as a result of fulfilment of the Agreement;\n\n4.1.7. Not to disclose any information about the EMI and its Holder (details, EMI number, information about the Payment Transaction, personal information of the PC Holder) to anyone, except as provided by law, including when it is necessary to complete the Payment Transaction;\n\n4.1.8. to return the funds to the EMI Holder in the case of returning the Goods, exclusively to the account of the EMI Holder, from which the payment for the Goods was previously made. It is forbidden to return funds in cash if payment for the relevant Goods was made in non-cash form using the EMI\n\n4.1.9. to provide information (official documents) necessary for proper verification in the field of prevention and countermeasures against legalisation (laundering) of proceeds of crime, financing of terrorism and financing of proliferation of weapons of mass destruction;\n\n4.1.10. during the term of this Agreement to provide information regarding all URL(s) owned and managed by the Merchant (active and dormant);\n\n4.1.11. do not to sell the following Goods, for which payment is made through the Virtual Payment Terminal:\n\n- sale of photographs, video images, computer images, cartoons, simulations or other means or actions containing, including, but not limited to: child pornography, goods/images promoting bestiality, violence and/or hatred, bodily harm, etc;\n\n- sale of weapons, spare parts, ammunition, cold steel weapons prohibited by law enforcement agencies, military equipment, explosives and means for making explosions, chemical warfare agents and means of protection against them;\n\n- sale of special technical means for covert acquisition and registration of acoustic and visual information, interception of information from technical communication channels, covert control over movement, covert inspection of premises, vehicles and other objects, regulatory and technical documentation for the production and use of such means;\n\n- sale of counterfeit, falsified goods, copies of original products (so-called replicas) made by a third-party manufacturer without the relevant intellectual property rights (as evidenced by licences; licence agreements; agreements on the creation and use of an intellectual property object; agreements on the transfer of exclusive intellectual property rights; etc;\n\n- remote sale of medicinal products without an appropriate licence;\n\n- remote sale of tobacco products without a relevant licence;\n\n- sale of biologically active additives;\n\n- sale of escort services and other sexual services, provision of access to adult content, including, but not limited to, subscriptions to websites and video streaming of adult content;\n\n- sale of narcotic and psychotropic drugs, including so-called designer drugs;\n\n- sale of government documents or identity cards;\n\n- sale of other goods or services, the free sale of which is prohibited or restricted by the laws.\n\n4.1.12. The Merchant shall promptly notify the Company in writing of any changes, alterations, or updates to the Merchant's information, bank details, data, or address, including but not limited to contact details, business address, and bank account information. Such notification must be provided at least 5 business days prior to the effective date of the amendment.\n\n4.1.13. The Merchant is responsible for continuously monitoring and ensuring compliance with the current version of the Payment Card Industry Data Security Standard (PCI-DSS). The Merchant must provide all required and updated PCI-DSS compliance documents to Company, including, but not limited to:\n\nthe current Attestation of Compliance (AoC) of any technical vendor involved in processing, storing, or transmitting cardholder data;\n\nthe applicable Self-Assessment Questionnaire (SAQ-A or SAQ-D), demonstrating the Client's compliance with PCI-DSS requirements;\n\nresults of the audit reports of the technical vendor(s), confirming their adherence to PCI-DSS standards.\n\nThese documents must be provided promptly upon request or in the event of any changes and kept up to date to reflect the latest compliance status.\n\n---\n\n## 5. RIGHTS AND OBLIGATIONS OF THE COMPANY\n\n5.1. The Company shall:\n\n5.1.1. No Unapproved Marketing Activity. The Company must obtain prior written approval of merchant for any public relations, marketing, and advertising activities that company desires to undertake as long as such involves any references to Merchant and its affiliated entities, employees or consultants, products, brands, names, titles and any other intellectual property and/or other proprietary rights. Strictly no licence, whether assumed, implied or explicit, is hereby granted for the use of any of the above under any circumstances without the prior written approval of Merchant.\n\n5.2. The Company has the right:\n\n5.2.1. To demand from the Merchant full and proper fulfilment of obligations under the terms of this Agreement.\n\n5.2.2. To inspect the Website(s) in order to monitor the Merchant's compliance with the provisions of this Agreement and/or the Mastercard Rules.\n\n5.2.3. To prevent Fraudulent transactions, set limits on Payment transactions using EMI.\n\n5.2.4. Without limitation and prior agreement with the Merchant, notify CoP Members of any illegal or unauthorised activities using EMI to stop or prevent possible Fraudulent Transactions.\n\n5.2.5. Receive the Commission Fee for the services rendered in accordance with the procedure and on the terms and conditions specified in this Agreement.\n\n5.2.6. During the investigation, do not credit the amount of funds to the Merchant's Account for any payment transaction for which PS has disputed a suspicious payment transaction, as well as for a fraudulent payment transaction for a period not exceeding 180 (one hundred and eighty) calendar days. At the same time, within 5 (five) days from the date of such suspension, the Company shall provide the Merchant with written explanations on this matter.\n\n5.2.7. Suspend the provision of services in case of suspicion that the transactions contain signs of a criminal offence without prior notice to the Merchant;\n\n5.2.8. To demand from the Merchant signed monthly report as set forth herein.\n\n---\n\n## 6. Payment Terms\n\n6.1. The Company Fee\n\n6.1.1. The Company Fee shall be calculated at the rates specified in the Terms of Business with regard to each payment method and shall be withheld by the Company from the Transaction Amounts.\n\n6.1.2 All payments to the Merchant under this Terms of Business shall be made in EURO (the \"Currency of the Agreement\"). In the event that Company receives the Transaction amounts in the currencies other than the Currency of the Terms of Business, the Company shall, at Company's cost, convert the said amounts into the Currency of the Terms of Business based upon the selling exchange rate published by the Bank of England on their website https://www.bankofengland.co.uk as of the day when the settlement is due to be made to the Merchant current account.\n\n6.1.3 The Parties agreed that all bank charges and commissions accrued by the Company's bank and the Merchant`s bank will be paid by the Company.\n\n6.1.4. The Company has the right to deduct the Company's Fee from the amount of the Transaction amounts. If the amount of the Company Fee exceeds the Settlement Amount for any applicable period, then the Company shall carry forward any unpaid balance of the Company Fee to subsequent Settlement Amounts and deduct such Company Fee from subsequent Settlement Amounts until such Company Fee is paid in full.\n\n6.1.5. Payments. The Company shall pay the Settlement Amount to the Merchant as set forth herein. The Company shall electronically disburse the Settlement Amount to the Merchant on the next Business Day for the previous Business Day during which the Transactions were settled.\n\n6.1.6. Rolling reserve (RR) will be paid upon expiration 180 days after termination of this Agreement if there are no sanctions or fees imposed by MasterCard on the Merchant's activity.\n\n6.1.7. Company has the right to retain the RR for up to 180 days if the Customer has deactivated their Online Stores. This provision is applicable in scenarios where the Online Store is closed, suspended, or stops accepting payments or providing services/goods without prior written notice to the Provider. Furthermore, if the Online Store is closed or suspended in part or in full, yet continues to process payments, such actions may be considered a breach of this Agreement.\n\n6.1.8. The Company shall have a right to transfer funds that are generated by the Company for the Merchant in accordance with this Agreement to the bank account of a Third Party, if it's approved by both Parties\n\n6.1.9 The Merchant may request to amend the settlement account and/or add another settlement account. The request must be submitted to the Company in writing.\n\n6.2 Reporting\n\n6.2.1. The Company shall generate a monthly report detailing transactions, fees and other relevant financial information pertaining to the Merchant's account;\n\n6.2.2. The Company shall provide the Merchant with monthly reports that shall follow the structure provided by Exhibit A hereof and shall be provided to the Merchant by the 10th day of each calendar month for the preceding month;\n\n6.2.3. The Merchant shall review, sign, and return the Monthly Report provided by the Company within five (5) working days of receipt. The signed Monthly Report shall be returned to the Company as acknowledgment and acceptance of the transactions and fees detailed therein;\n\n6.2.4. The Company will send the report in electronic format (e.g., CSV, Excel, or PDF) to the email address designated by the Merchant; and\n\n6.2.5 Should the Merchant identify any discrepancies or errors in the Monthly Report, the Merchant shall notify the Company in writing within the five (5) working days review period. The Company shall investigate and resolve any identified discrepancies in a timely manner.\n\n---\n\n## 7. LIMITATION OF LIABILITY\n\n7.1. The Merchant warrants and undertakes:\n\n- to conduct business exclusively through the approved URLs and MCCs, set forth in an Addendum \"Terms of Business Agreement\". These URLs are the only channels through which the Merchant's customers may purchase and utilise various interactive content, virtual goods, and/or services strictly under the approved MCCs;\n\n- to obtain written permission from the Company for all subsequent URLs and MCCs that the Merchant intends to use for operating the Virtual Payment Terminal. Any new URLs and MCCs must be approved in writing by the Company before they can be used for business operations;\n\n- to operate only through the approved currencies, set forth in an Addendum \"Terms of Business Agreement\". Any new currencies must be approved in writing by the Company before they can be used for business operations;\n\n- to operate only in the approved territories, as set forth in an Addendum \"Terms of Business Agreement\". Any new territories must be approved in writing by the Company before they can be used for business operations;\n\n- not providing, licensing and using the Virtual Payment Terminal not authorised by the Company;\n\n- to ensure that all transactions are conducted in accordance with the terms and conditions of herein and any additional guidelines provided by the Company.\n\n7.2. The full liability of the Parties as a result of the failure of the other Party to fulfil any of its obligations under this Agreement will be the actual direct damages of the Parties that can be proven in court.\n\n7.3. Neither party shall be liable to the other party for any incidental, indirect or consequential damages such as, but not limited to, compensation or damages for loss of present or prospective profits or revenues, loss of actual or anticipated fees on sales or anticipated sales, or expenditures, investments or commitments made in connection with this agreement or in connection with the performance of obligations hereunder.\n\n---\n\n## 8. TERM AND TERMINATION\n\n8.1. Term. The term of this Agreement shall commence on the Effective Date and shall continue in effect for a period of one (1) year (the \"Initial Term\"). This Agreement is renewed automatically for the next one (1) year, unless one of the Parties declares to terminate this Agreement.\n\n8.2. Any Party may terminate this Agreement for no cause by sending a written notice thereof at least 30 days before the proposed termination date. The Company can terminate this Agreement immediately if theMerchant violates the Mastercard Rules and this Agreement.\n\n8.3. Effect of Termination. Upon termination by either Party, the Merchant shall be liable for all outstanding obligations to the Company and the Company shall be liable for all outstanding obligations to the Merchant. Each Party shall immediately remove from its displays and cease use of any icons and other trademarks or logos that belong to the other Party. The Company shall promptly inform its other relevant partners that the Agreement between the Company and the Merchant has terminated.\n\n---\n\n## 9. CONFIDENTIALITY AND NON-USE\n\n9.1. The Confidential Information. Each Party acknowledges that it will have access to proprietary or the Confidential Information (the \"Confidential Information\") of the other Party, including, but not limited to, the terms of this Agreement. The Confidential Information entitled to protection under this Agreement shall include, without limitation, technical data, trade secrets, any plans with regard to the products or the Services of the either Party, the Customer or the Supplier lists including without limitation databases, marketing plans, software, source codes for various software, processes, technology, inventions, and designs, either party's financial information including, without limitation, its books and records, either party's marketing information, either party's or a third party's confidential product information, whether or not any such information is marked as confidential, and, in addition, any other information identified as confidential by appropriate markings on any documents exchanged or, if disclosed orally, on a subsequent written notice provided within ten (10) calendar days since disclosure.\n\n9.2. Protection of Confidential Information. Each party will protect the Confidential Information of the other Party in the same manner in which it protects its own Confidential Information (but in any event will use no less than reasonable care), except as may be specifically permitted hereunder. The Confidential Information shall be used for the purposes related to this Agreement only. The Confidential Information shall only be disclosed to the employees of the Parties who need access to it for successful performance of this Agreement.\n\n9.3. Exceptions. The obligations of confidentiality and non-use specified above will not apply to any information of one Party which:\n\n9.3.1 was known by the other Party prior to the date of this Agreement and not obtained or derived, directly or indirectly, from disclosing Party or its affiliates, or if so obtained or derived and is not held subject to any confidentiality or non-use obligations;\n\n9.3.2. is or becomes public or available to the general public otherwise than through any act or default of the receiving Party in violation of the provisions of this Agreement;\n\n9.3.3. is obtained or derived prior or subsequent to the date of this Agreement from a third Party which is lawfully in possession of such information and does not hold such information subject to any confidentiality or non-use obligations;\n\n9.3.4. is independently developed by a Party without use of the disclosing Party's Confidential Information;\n\n9.3.5. is required to be disclosed by one of the Parties pursuant to applicable law or court order, provided, however, that the obligations of confidentiality and non-use will continue to the fullest extent, not in conflict with such law or order; and, if and when a Party is required to disclose such Confidential Information pursuant to any such law or order, such party will, to the extent legally permissible, give notice to the other party to allow such other party to make efforts to obtain a protective order or take such other actions as will prevent or limit public access to, or disclosure of, such Confidential Information.\n\n9.4. Access to Confidential Information. Access to all Confidential Information shall be restricted to those employees of the receiving Party's immediate organisation, parent corporations, subsidiaries, and other persons, such as consultants, attorneys, and other advisors having a need to know to perform services specifically requested by one Party or the other to fulfil the purpose of this Agreement. The receiving Party shall notify such employees or persons of the proprietary nature of the Confidential Information and shall require such employees or other persons to agree in the form of a non-disclosure agreement enforceable in the respective jurisdiction to maintain the confidentiality of the Confidential Information on the same terms as set forth herein. Except as expressly permitted by this Agreement, the Confidential Information shall not be disclosed to any third Party without the prior written consent of the disclosing Party\n\n9.5. These Confidential Information provisions shall be valid for the duration of the Agreement and for 1 (one) year afterwards.\n\n---\n\n## 10. GOVERNING LAW. DISPUTE RESOLUTION.\n\n10.1. The Agreement shall be governed by the law England and Wales\n\n10.2. The Parties will attempt to settle all disputes and disagreements arising from this Agreement and related to the execution, validity and termination of this Agreement through negotiations within 30 (thirty) Business Days. If the Parties are unable to resolve the dispute, dispute shall be exclusively and finally resolved by binding confidential arbitration administered by the London Courts of the International Arbitration (\"LCIA\") under LCIA Rules, with one arbitrator to be appointed by mutual agreement of the Parties. The seat of arbitration shall be London, and the language of arbitration shall be English. All costs of arbitration, including court costs, will be borne by the unsuccessful party. The Parties agree to carry out any arbitral award without delay. The arbitration award may be enforced by any court of competent jurisdiction.\n\n---\n\n## 11. AMENDMENTS AND MODIFICATION.\n\n11.1. No variation of this Agreement shall be effective unless it is in writing and signed by or on behalf of each party. Notwithstanding this, the parties agree that any future changes, alterations, or updates to the terms of this Agreement, including but not limited to changes in information, data, address, fees, commissions, MCC codes or services, shall be governed by a single standard additional agreement named \"Addendum \"Terms of Business Agreement\" set forth herein. This Terms of Business agreement, once executed, shall be deemed incorporated by reference and shall form an integral part of this Agreement.\n\n11.2. Either party may propose changes covered by Terms of Business Agreement by submitting a written request to the other party.\n\n11.3. Proposed changes shall be documented using the Terms of Business Agreement.\n\n11.4. Both parties must approve and sign the Terms of Business Agreement for the changes to be effective.\n\n11.5. The changes outlined in the Terms of Business Agreement shall take effect on the date specified there, provided that the form has been duly executed by both parties.\n\n11.6. This Agreement shall be reviewed and updated on an annual basis, or as necessary, to ensure it remains current and accurate. Each updated version of the Terms of Business Agreement shall supersede the previous version and be deemed an integral part of the herein.\n\n11.7. By incorporating this clause, the Parties ensure that all future amendments are managed through a single, regularly updated document, thereby simplifying the process and maintaining clarity in the Agreement.\n\n---\n\n## 12. GENERAL PROVISIONS.\n\n12.1. Force Majeure. No Party shall be deemed in default of this Agreement to the extent that performance of its respective obligations or attempts to cure any breach are delayed or prevented by reason of any Act of God, fire, natural disaster, accident, act of government, or any other cause beyond the reasonable control of such Party; provided, that the Party influenced by such force majeure circumstances shall, within the period of seven (7) calendar days, notify the other Party by cable or fax message of emergence, type and expected duration of force majeure circumstances preventing the notifying Party from performance of its obligations under this Agreement. The existence of such force majeure circumstances must be confirmed by a Chamber of Commerce or other authorised independent body within 3 weeks since the date of force majeure event. If such notification is not sent in accordance with the above provision, the Party influenced by force majeure circumstances shall not have the right to refer to such force majeure circumstances as the reason for its non-performance of obligations under this Agreement. During the existence of force majeure circumstances releasing the Parties from their obligations hereunder, the Parties suspend the performance of their obligations without any sanctions. In the event of such force majeure circumstances existing for the period of over three (3) months, the Parties shall negotiate further performance of this Agreement. If the Parties do not come to an agreement in this respect, each of the Parties has the right to terminate this Agreement immediately and unilaterally by sending the other Party a notice of termination.\n\n12.2. No Partnership. Nothing contained in this Agreement shall be construed as creating any partnership, employer-employee relationship or joint venture between the Parties. Neither Party shall be authorised to act as an agent for the other, nor shall either Party enter into any agreement or contract on behalf of the other as representative or agent.\n\n12.3. Entire Agreement. This Agreement, combined with the Addendum, Schedules, Exhibits, Annexes and Appendices attached hereto, constitutes the entire agreement between the Parties with respect to the subject matter hereof and supersedes all prior negotiations, understandings, and agreements, whether oral or written between the Parties hereto concerning the subject matter hereof.\n\n12.4. No Reliance. Each party acknowledges that, in entering into this Agreement, it does not rely on, and shall have no remedy in respect of, any statement, representation, warranty, or understanding (whether negligently or innocently made) of any person (whether a party to this Agreement or not) other than as expressly set out in this Agreement.\n\n12.5. Precedence. In the event of any conflict or inconsistency between the terms of this Agreement and any other document referred to herein, the terms of this Agreement shall prevail.\n\n12.6. Severability. Should any provision of this Agreement be determined to be unenforceable or prohibited by any applicable law, such provision shall be ineffective to the extent, and only to the extent, of such unenforceability or prohibition without invalidating the balance of such provision or any other provision of this Agreement. The Parties agree and undertake to amend this Agreement as necessary in such a manner as to legally permit them to fulfil their obligations hereunder.\n\n12.7. Headings. Section headings are inserted for convenience and shall not define, limit, construe or describe the scope or extent of such section.\n\n12.8. Written Modification. No modification, addendum, amendment, clarification of this Agreement or of any provision hereof shall be effective unless in writing and signed by both Parties. Scanned copies of this Agreements and any documents thereto shall be legally binding if signed by authorised representatives of the Parties.\n\n12.9. This Agreement is made in two (2) copies, both in English, one copy for each of the Parties.\n\nIN WITNESS WHEREOF, the undersigned hereby acknowledge that they have read and understand the terms of this Agreement, and that by signing this Agreement they agree to be bound by all terms, conditions, and obligations contained herein.\n\n---\n\n## 13. SIGNATURES AND DETAILS OF THE PARTIES.\n\n### \"MERCHANT\"\n\nBy: **WEBNORUS LIMITED**\n\nName: **Vitalijs LOMAKO**\nTitle: Director\n\nSignature: _____________________\n\n---\n\n### \"COMPANY\"\n\nBy: **SMARTFLOW PAYMENTS LIMITED**\n\nName: **Anastasiia Pervushyna**\nTitle: Director\n\nSignature: _____________________\n\n---\n\n---\n\n# EXHIBIT A\n\n## Form of Monthly Report\n\nThe act of reconciliation of mutual settlements No [number]\n\n| Field | Value |\n|-------|-------|\n| Start of the current Reporting Period: | [date] |\n| End of the current Reporting Period: | [date] |\n\nSMARTFLOW PAYMENTS LIMITED, hereafter the \u00abCompany\u00bb and **WEBNORUS LIMITED** hereafter the \u00abMerchant\u00bb agreed the following report:\n\n| No | Description | Amount | Currency |\n|----|-------------|--------|----------|\n| 1 | The outstanding debt of the Company to the Merchant at the beginning of the accounting period | | EUR |\n| 2 | The total amount of collected customer payments | | EUR |\n| 3 | The amount of the Company Fee due | | EUR |\n| 4 | The amount of Rolling Reserve acquired during this period | | EUR |\n| 5 | The total amount of Rolling Reserve | | EUR |\n| 6 | The amount of customer transactions minus Company Fee due, Rolling Reserve | | EUR |\n| 7 | The quantity of customer transactions made throughout the period | | |\n| 8 | The total Supplier Settlement Amount transferred to the Merchant within the reporting period | | EUR |\n| 9 | The amount of Chargebacks | | EUR |\n| 10 | The quantity of Chargebacks | | |\n| 11 | The amount of Refunds and Fraud | | EUR |\n| 12 | The quantity of Refunds and Fraud | | |\n| 13 | Representment amount | | EUR |\n| 14 | The amount of returned Chargebacks | | EUR |\n| 15 | The outstanding debt of the Company to the Merchant at the end of the accounting period | | EUR |\n\nParties confirm that the above mentioned Amounts are correct and they do not have complaints to each other.\n\n| Company: | Merchant: |\n|----------|-----------|\n\n---\n\n---\n\n# Terms of Business Agreement\n\n## Addendum to the Payment Management Services Agreement NO 0209-25\n\n**Date: 2d September 2025**\n\n**WEBNORUS LIMITED**, a legal entity duly established and acting under the laws of the United Kingdom, with the registered number 15668312, and registered address is 33 St. Leonards Road, Hull, England, HU5 1BE, represented by the **Director Vitalijs LOMAKO** acted on the basis of the Article of Association (hereinafter referred to as \"Merchant\"), and\n\n**SMARTFLOW PAYMENTS LIMITED**, a legal entity duly established and acting under the laws of England and Wales with the registered number 11070048, registered office is at: Office 39.18 Level39 One Canada Square, London, England, E14 5AB, represented by the **Director Anastasiia Pervushyna** acted on the basis of the Article of Association (hereinafter referred to as the \"Company\")\n\nThe Company and the Merchant hereby agree that the following updated terms and conditions, and those set forth in Terms of Business Agreement attached hereto, shall be binding upon the Parties.\n\n---\n\n## COMPANY FEE. COMPANY PAYMENT OPTIONS\n\n| No. | Online services | Company Fee, % |\n|-----|-----------------|----------------|\n| 1. | Internet acquiring, EUR, GBP<br>Apple Pay and Google Pay | 3.8 % |\n| 2. | Chargeback | 50 EUR |\n| 3. | Refund | 5 EUR |\n| 4. | RR | 10%, no more than 37,500 EUR |\n\n---\n\n## APPROVED TERMS\n\n| No. | Terms | |\n|-----|-------|---|\n| 1. | URLS | https://ninja-skins.com/ |\n| 2. | MCC | 5816 |\n| 3. | Currencies | EUR, GBP |\n| 4. | Territories | EU, GB |\n\n---\n\n## SETTLEMENT ACCOUNTS\n\n| No. | Company Name | Bank Details |\n|-----|--------------|--------------|\n| 1. | **WEBNORUS LIMITED** | IBAN: SM050189990980000EEX1110028<br>Account Holder Name: Webnorus Limited OU<br>Bank Name: THE 3ROOKS MONEY S.P.A<br>Bank Address: VIA MONALDO DA FALCIANO 6<br>BIC: RMOESMS2XXX |\n| 2. | **SMARTFLOW PAYMENTS LIMITED** | Account Holder Name: SMARTFLOW PAYMENTS LIMITED<br>IBAN: CH6308843243421270710<br>Bank Name: Dukascopy Bank SA<br>Bank Address: Route de Pr\u00e9-Bois 20, Gen\u00e8ve 1215, Switzerland (CH)<br>BIC: DUBACHGGXXX<br><br>IBAN: LT463880010100316908<br>Account Number: 10100316908<br>Account Holder Name: SMARTFLOW PAYMENTS LIMITED<br>Bank Name: Payswix, UAB<br>Bank Address: Lvovo g. 25-104, LT-09320 Vilnius, Lithuania<br>BIC: GLUALT22XXX |\n\n---\n\n## CONTACT DETAILS\n\n| WEBNORUS LIMITED | SMARTFLOW PAYMENTS LIMITED |\n|------------------|---------------------------|\n| NAME: **Vitalijs LOMAKO**<br>EMAIL: business@ninja-skins.com | NAME: **Anastasiia Pervushyna**<br>EMAIL: apa@sends.co |\n\n---\n\n## SIGNATURES AND DETAILS OF THE PARTIES\n\n### \"MERCHANT\"\n\nBy: **WEBNORUS LIMITED**\n\nName: **Vitalijs LOMAKO**\nTitle: Director\n\nSignature: _____________________\n\n---\n\n### \"COMPANY\"\n\nBy: **SMARTFLOW PAYMENTS LIMITED**\n\nName: **Anastasiia Pervushyna**\nTitle: Director\n\nSignature: _____________________\n\n---\n\n---\n\n# SERVICES AGREEMENT\n## GENERAL TERMS AND CONDITIONS No 25/01-10/OB\n\n**London \u00ab01\u00bb October 2025**\n\n---\n\n## Preamble\n\n**FINTHESIS LTD** is a licensed payment institution which was authorised to provide payment services under Licence 924263 issued by the FCA UK, principal place of business: 2-4 Eastern Road, Imperial Offices, Romford, England, RM1 3PJ, Registration number: 12431685, duly represented by Director **Yuliia NIKULINA**, hereinafter referred to as the \"Company\", acting on the basis of the Charter;\n\n**WEBNORUS LIMITED**, registered in United Kingdom, bearing Company registration number 15668312, and having its registered address, 33 St. Leonards Road, Hull, England HU5 1BE, duly represented by director **Vitalijs Lomako**, acting on the basis of the Articles of Association, on the other hand, hereinafter referred to as the \"Customer\"\n\nThe Customer intends to engage the Company to provide the Company's Services mentioned herein for the benefit of the Customer's Clients;\n\nTherefore, the Parties have entered into this Services Agreement (the Agreement) as per The Money Laundering, Terrorist Financing and Transfer of Funds (Information on the Payer) Regulations 2017, Proceeds of Crime Act 2002, The Financial Services and Markets Act 2000 (FSMA) and the others documents on the prevention of the use of the financial system for the purposes of money laundering or terrorist financing (the AML/CFT Law) and have agreed as set forth below.\n\n---\n\n## 1. DEFINITIONS\n\nAll capitalised terms used in this Agreement (including all and any amendments and appendices hereto) shall have the meaning described in this Section, except as otherwise provided herein or as the context may otherwise require.\n\n1.1. **Agreement** means this agreement for services executed by and between the Parties together with all its annexes as well as subsequent amendments and supplements.\n\n1.2. **Applicable Laws** mean all applicable provisions of all laws, treaties, regulations, orders of governmental authorities and all orders and decrees of all courts and arbitrators that are applicable to the Parties.\n\n1.3. **API** means an open communication technical interface which is based on RESTful architecture and is compliant with EBA-RTS requirements.\n\n1.4. **Beneficial Owner** has the meaning defined in the Money Laundering, Terrorist Financing and Transfer of Funds (Information on the Payer) Regulations 2017 and other Applicable Laws.\n\n1.5. **Company** means FINTHESIS LTD, a licensed payment institution which was authorised to provide payment services under Licence 924263 issued by the FCA UK, principal place of business: 2-4 Eastern Road, Imperial Offices, Romford, England, RM1 3PJ, Registration number: 12431685, duly represented by Director Yuliia Nikulina, acting on the basis of the Charter;\n\n1.6. **Company's Website** is a https://paio.company/en\n\n1.7. **Customer's Client** means a natural or a legal person to whom the Customer provides services and grants the right to use the platform managed by the Customer.\n\n1.8. **Customer Websites** mean the Customer websites (as approved by the Company) through which the Customer's Clients and/or Persons may access Customers products and/or services.\n\n1.9. **Financial Partners** means the partners of the Company having the relevant licence (AEMI, EMI, small EMI, API and Payment Institution or their analogue) which may be involved in the process of providing services, acceptance and pay-out the funds and information exchange for the purposes of proper providing services by the Company to the Customer;\n\n1.10. **Information** means payer's identification code and payment amount and all other information related to the Customer (Related Persons of the Customer) Customer's Client and/or Person that becomes known to the Company from the Customer for the purposes of execution of the Agreement and performance of the services hereunder.\n\n1.11. **Parties** mean the Company and Customer collectively.\n\n1.12. **Payment Initiation** means a payment instruction initiated by the Company at the request of the Person to transfer funds for the products and/or services of the Customer and/or Customer's Client from the account of the Person.\n\n1.13. **Person** means a person who is a client of the Customer's Client and who initiates the payment for the products and/or services of the Customer's Client using the Payment Initiation service through the Customer's platform.\n\n1.14. **Price of Services** means the consideration of the Customer paid for the Services provided.\n\n1.15. **Related Persons** is the person or entity that has the ability to control, or is controlled by, or is under common control with the Customer, control being the power to govern the financial and operating policies so as to benefit from its activities; or exercises significant influence over the entity in making financial and operating decisions, i.e. the power to participate in the financial and operating policy decisions of an entity, but not to control those policies;\n\n1.16. **Sanctions** mean a set of regulations applicable to the Customer and Related Persons of the Customer and/or the Company in connection with any commercial, economic or financial sanctions or embargoes related to corruption, money laundering or terrorist financing.\n\n1.17. **Services**, without limitation, comprise services provided by the Company to the Customer, as described in Section 2, 3 of this Agreement.\n\n1.18. **Special Conditions** mean the part of this Agreement\n\n---\n\n## 2. SCOPE OF AGREEMENT\n\n2.1. The Company hereby provides the Customer with an opportunity to initiate Payment Initiation Service, as described above, via Company's services and it's Financial Partners, and the Customer undertakes to accept such Services and pay for it under the terms and conditions contained herein.\n\n2.2. The Company undertakes to provide the Services to the Customer for the benefit of the Customer's Clients and/or Persons. The Customer intends to engage the Company to facilitate the Customer's services provided to the Customer's Clients and/or Persons.\n\n2.3. The Company provides the Services hereunder in one of two methods: (i) the Customer receives funds from the Customer's Clients and/or Persons to the Customer's bank account from the accounts of the Customer's Clients and/or Persons through the Payment Initiation Service provided by the Company; or (ii) the Company provides the Services of collection the funds from the Customer's Clients and/or Persons through the Payment Initiation Service provided by the Company, and their further repayment to the Customer. The specific method of the Services is specified in Annex 1 of this Agreement.\n\n2.4. In case the method mentioned in Sec. \"ii\" 2.3 of the Agreement applies, the Customer provides and grants the Company consent, order, permission to collect and store Customer's and/or Customer's Clients and/or Persons' funds in current accounts belonging to the Company for the further reimbursement of the funds to the Customer and/or Customer's Client and/or Person.\n\n2.5. Notwithstanding above, nothing in this Agreement means, implies or can be considered that the Company offers the Services to the Customer's Clients and/or Persons and/or enters into any direct contract and/or contractual obligations with them. The Parties expressly provided and agreed that Customer bears sole and exclusive responsibility to Customer's Clients and/or Persons in connection with the Services. The Company shall not be liable for any delay in the provision of the Services other than caused by any action or omission on the part of the Company.\n\n---\n\n## 3. SERVICES\n\n3.1. From the Effective date and for the period of validity of the Agreement or until it is terminated as described below the Company undertakes to provide the Customer with an opportunity to use the Payment Initiation service provided by the Company.\n\n3.2. The Company within ten (10) business days after the Effective date shall provide the Customer with the identification code via API allowing the Customer to gain an access to the Company's Payment Initiation service which made the Payment Initiation transaction available for the Customer, Customer's Client and/or Person (depending on who shall initiate the transaction).\n\n3.3. After the access to the Payment Initiation Service is received, the Company starts to provide the Customer, Customer's Client and/or Person (depending on who had initiated the transaction) via API with a respective notice confirming the completion of the Payment Initiation transaction.\n\n---\n\n## 4. RIGHTS AND OBLIGATIONS OF THE COMPANY\n\n4.1. The Company shall:\n\n4.1.1. ensure the implementation of high standards for API quality;\n\n4.1.2. provide to the Customer technical specifications in order to access and start using the Services;\n\n4.1.3. request the Customer to change settings for technical integration of the Service. In such a case the Company shall provide the Customer with the updated instructions;\n\n4.1.4. provide the Services in a professional, careful and diligent manner in accordance with the provisions of the Agreement and Applicable Laws;\n\n4.1.5. negotiate any derogations from the terms of the Agreement that may negatively affect on the provision of the Services;\n\n4.1.6. provide the Services to Customer in case the Customer fully performed his obligations described in Clauses 5.1.13. and 5.1.14. hereof;\n\n4.1.7. provide information related to and performed of this Agreement to national and international supervisory authorities in case the Applicable Law is expressly prescribe such actions or respective request have been received by the Company;\n\n4.1.8. provide the Customer an opportunity to receive the information about the results of execution of the Customer's Client's and/or Person's payment order (depending on who had initiated the transaction) and promptly inform the Customer in cases when funds cannot be credited due to errors in the payment order or insufficiency of information.\n\n4.2. For the purpose of ensuring successful performance under this Agreement the Company shall:\n\n4.2.1. receive the Information from the Customer in order to start providing the Service to the Customer;\n\n4.2.2. choose the methods and means of performance of this Agreement using high quality level, best standards and efforts;\n\n4.2.3. comply with the laws, regulations, recommendations of the supervisory authorities and the terms of this Agreement.\n\n4.3. To ensure full availability of the Company's information system and to mitigate, prevent and avoid potential losses and damages of the Parties the Company at any time has the right to carry out technical or other works relating to the eliminating the malfunctions in the Company's information system in order upgrading the hardware and software package and ensure high quality of services. In this case, the Company is obliged to notify the Customer in advance about the proposed work through the Company's website. The Company shall perform such works within the shortest period reasonably possible. During the elimination of malfunctions in the information system, the fulfilment of all obligations of the Customer performed through the information system may be suspended. The Company shall not be responsible for each and any Customer's loss or damage resulting from the suspension of the Company's obligations or the elimination of malfunctions in the Company's information system.\n\n---\n\n## 5. RIGHTS AND OBLIGATIONS OF THE CUSTOMER\n\n5.1. The Customer shall:\n\n5.1.1. accept the Services provided by the Company and pay the Price of Services;\n\n5.1.2. notify the Company of the Bank account details of the Customer to be used for transfer of funds;\n\n5.1.3. promptly notify the Company of the change of details of the Bank account of the Customer to be used for transfer of funds;\n\n5.1.4. promptly notify the Company of the Customer's Website and changes in the Customer's Website address and/or changes of goods and/or services offered in the Customer's Website;\n\n5.1.5. ensure that the Customer's Website provides relevant, complete, accurate and transparent information about the Customer, offered goods and/or services, the main pre-contractual information and other relevant information including but not limited to: (i) the Customer's name, company or other registration number, registered office address; (ii) the Customer's contact details; (iii) the Customer's terms of cancellation of the services; (iv) data protection policy;\n\n5.1.6. provide the Company with the complete and accurate information reasonably necessary to ensure the proper execution the Services or which is requested by the Company in written;\n\n5.1.7. have obtained all permits and licences required by the Applicable Laws in order to enter into this Agreement and provide the services to the Customer's Clients and/or Persons;\n\n5.1.8. comply with the Company's reasonable directions and request with regard to the testing of the Services integration between the Customer's and the Company's information system. The Customer hereby acknowledge and accept that incorrect integration of the information systems of the Parties may affect the execution of this Agreement and the Payment Initiations made hereunder;\n\n5.1.9. be solely liable for the settlement with the Customer's Clients and/or Persons using the agreed settlement method;\n\n5.1.10. follow the Company's instructions to implement the requested changes and/or updates of the Services in order to continue the use of the Services;\n\n5.1.11. strictly refrain from making any representations and warranties to the Customer's Clients and/or Persons on behalf of the Company in relation to the Services;\n\n5.1.12. complete the \"Know Your Customer\" (KYC) questionnaire by complying with the requirements of money laundering and terrorist financing prevention acts, sanctions and other legal acts designated to and based on KYC and anti-money laundering and/or combating the financing of terrorism principles;\n\n5.1.13. bear full responsibility for the completeness and accuracy of the information in the KYC questionnaire;\n\n5.1.14. notify the Company within 3 (three) business days from the moment the changes of details or information indicated in the KYC questionnaire (including information on Beneficial owners, shareholders, managers, directors, authorized persons legal entity type (form), name, legal status, main activity, address, financial standing, website, clients and etc.) come into force;\n\n5.1.15. refrain from any of the following actions:\n\n(a) spreading computer viruses and using other measures that might disrupt the operation of the Company's information systems, harm or destroy information and cause any other damage to the systems, equipment or information;\n\n(b) any other deliberate actions that would disrupt in the provision of the Services or the operation of API and/or the Company's information systems;\n\n(c) organising illegal gambling, prostitution services, trading in tobacco products, alcohol, prescription drugs, narcotic substances and drug-related merchandise, steroids, weapons, pornographic material, unlicensed lotteries, illegal software and other items or products prohibited by law;\n\n(d) provision of services prohibited by law.\n\n(e) other illegal services.\n\n5.2. The Customer hereby acknowledges that the Company commences providing the Services only if the Customer submits all and any information and documents reasonably requested by the Company to perform KYC procedures and assessment of the risks imposed by the Customer and Customer's Website and the submitted documentation regarding KYC procedure are confirmed by the Company.\n\n5.3. The Customer shall also have other rights and obligations specified in the Agreement and Applicable Laws.\n\n---\n\n## 6. DISRUPTION OR SUSPENSION\n\n6.1. The Company shall not be liable for any disruption in any Service due to, but not limited to failure of the hardware, software or other infrastructure used by the Company, disruption of internet connection, API interface or other technical breakdowns, which does not qualify as Force Majeure circumstance, provided the Company makes reasonable efforts to restore the Services in order to avoid potential losses for itself and/or the other Party.\n\n6.2. The Company shall be entitled to suspend and/or terminate the provision of the Services in case of the breach of the terms of the Agreement by the Customer, with prior written notice the Customer.\n\n---\n\n## 7. GENERAL RIGHTS AND OBLIGATIONS OF THE PARTIES\n\n7.1. The Parties shall fulfil obligations assumed under the Agreement in full accordance of the Applicable Laws and in a good faith and a timely manner.\n\n7.2. The Parties shall notify each other of works to be carried out in the information systems which may affect the provision of the Services under this Agreement:\n\n7.2.1. known scheduled works \u2013 no later than one (1) business day before the commencement of scheduled works;\n\n7.2.2. unscheduled preventive works or failures \u2013 promptly.\n\n7.3. The Company shall provide information on all scheduled and unscheduled works Company's website.\n\n7.4. No later than fifteen (15) calendar days in advance either Party shall notify the other Party of any changes in its website and/or online store that may affect the provision of Services. Upon receipt of the relevant information, the other Party shall procure that all required changes shall be made in the information systems used by it in a timely manner.\n\n---\n\n## 8. REPRESENTATIONS AND WARRANTIES OF THE PARTIES\n\n8.1. Each Party hereby represents and warrants to the other Party that:\n\n8.1.1. the Party is lawfully established and validly existing under the laws of the country of its incorporation;\n\n8.1.2. the Party has the necessary power, authority and approvals to execute and perform this Agreement which constitutes a valid and binding obligation of the respective Party enforceable against the Party in accordance with its terms;\n\n8.1.3. the Party has taken all legal actions required to properly enter into and give effect to this Agreement has obtained all permits and licenses required by law and has the employees required for the delivery or receipt of the Services;\n\n8.1.4. neither the execution of this Agreement nor compliance by the Parties with the obligations assumed hereunder conflicts with, or results in a breach or violation of, any of the terms and provisions of (i) any decision, judgment, order, decree or instruction or injunction of any court, public or municipal authority to which the Parties are subject; (ii) any agreement or any other transaction to which the respective Party is a party; or (iii) any law or other regulation applicable to the Parties; (iv) the rights and lawful interests of the creditors or shareholders of the Parties.\n\n---\n\n## 9. CONFIDENTIALITY OBLIGATIONS\n\n9.1. The Parties shall not disclose any Information provided to it during the performance of the Agreement or related to the performance of the Agreement to any third party and shall not make available such Information, either in full or in part, to any third party during the term of the Agreement and thereafter for an indefinite period without the prior written consent of the other Party, unless such disclosure is required by the Applicable Laws.\n\n9.2. All information provided by either Party shall be deemed confidential and shall be provided solely for the benefit of the other Party. The Parties shall not disclose, mention in public or make available such information to any third party, except where such disclosure is required by the mandatory provisions of the Applicable Laws, or with the prior written consent of the other Party to each specific disclosure, whose consent shall not be unreasonably withheld.\n\n9.3. The confidentiality obligation shall not apply in respect of the above information (except for personal data) if:\n\n9.3.1. it is in the public domain;\n\n9.3.2. it becomes generally known to the public otherwise than through the breach of this obligation;\n\n9.3.3. it was lawfully obtained by the Party prior to the execution of the Agreement;\n\n9.3.4. it has been independently acquired (created, developed, investigated, etc.) by the Party by lawful means;\n\n9.3.5. it was lawfully received by the Party from a third party not under any obligation of confidentiality with respect thereto.\n\n---\n\n## 10. PERSONAL DATA\n\n10.1. The Parties act as independent data controllers and shall process the various personal data obtained during the performance of the Agreement as required by GDPR law and shall ensure the protection of personal data made available to them at their own cost and expense and by their own means. The Parties shall execute a separate agreement regarding the processing of personal data which constitutes an integral part of the Agreement.\n\n---\n\n## 11. LIABILITY OF THE PARTIES\n\n11.1. The Party shall be held liable only for direct losses incurred as a result of a direct or material breach of the Agreement. The Party shall not be liable for consequential or indirect losses, such as loss of profits, opportunity or reputation or resulting from the circumstances specified in Clause 4.3.\n\n11.2. The Party's liability shall not exceed the amount of fees paid by the Customer to the Company for the last twelve (12) months for the provision of the Services. If the average of twelve (12) months cannot be calculated, the compensation shall be calculated at the minimum extent of the actual duration of the usage of the Services.\n\n11.3. The Party shall be liable for the direct losses which are from or are incurred by reason of the Party's (i) breach of any Applicable Laws, regulatory requirements or contractual provisions; (ii) breach of any material obligations set forth in this Agreement; (iii) the wilful misconduct or deliberate conduct of any employee of the Party in connection with the obligations applicable upon either Party under this Agreement.\n\n11.4. The Parties shall not be liable to indemnify damages that result from any failure in the communication lines or interruption in power supply, preventive works carried out in relation to the information systems of the Party that have been notified by the Party to the other Party.\n\n11.5. The Company shall not be liable for the goods and/or services of the Customer (e.g. quality of the good, delivery, etc.), the operation of the Customer's Website, the content and information contained therein, as well as solving or mediating disputes between the Customers and the Customer.\n\n11.6. The Party shall be obliged to pay to the other Paty for all direct losses and fines incurred by the other Party if these arise from or are incurred by reason of the Party's breach of any Applicable Laws requirements under anti-money laundering, terrorist financing, fraud or any other financial crime laws and regulations.\n\n---\n\n## 12. AMENDMENTS OF THE AGREEMENT\n\n12.1. The Company may unilaterally amend and/or supplement the Agreement by notifying the Customer no later than sixty (60) calendar days before the amendments enter into force.\n\n12.2. The Customer may agree or disagree with such changes as specified in Clause 12.1. prior to the proposed enforcement date of such changes:\n\n12.2.1. it shall be considered that the Customer agrees with such changes and the proposed changes shall enter into force on the specified enforcement date if prior to the day of their enforcement the Customer does not notify the Company of the disagreement with the changes;\n\n12.2.2. the Customer, who disagrees with the changes proposed by the Company, shall have the right to terminate the Agreement without commission applied by notifying the Company in writing prior to the proposed enforcement date of such changes.\n\n12.3. The sixty (60) days' notice period will not apply where the changes relate to the addition of a new service or extra functionality to the existing Services and do not create new financial obligations to the Customer. In such instances, the changes will be made and shall be effective immediately upon giving the Customer notice of it.\n\n12.4. The Customer is not entitled to object to and shall not have the rights set out in this clause for any change, which the Company implements in order to comply with Applicable Law. For such imposed changes shorter notice periods may be imposed.\n\n---\n\n## 13. VALIDITY AND TERMINATION OF THE AGREEMENT\n\n13.1. The Agreement shall enter into force from the date firstly indicated above (the Effective date) and shall keep its validity, be in full force and legally binding until terminated by the Parties under procedure set forth below herein.\n\n13.2. This Agreement may be terminated by written agreement of the Parties.\n\n13.3. The Party has the right to terminate the Agreement unilaterally without any reason upon thirty (30) calendar day's prior written notice thereof.\n\n13.4. The Company may terminate the Agreement immediately in case:\n\n13.4.1. the Customer fails to submit the KYC questionnaire or submitted information in the KYC questionnaire is inaccurate, incorrect or not indicated;\n\n13.4.2. the Customer fails to inform the Company within three (3) business days from the moment the changes of details indicated in the KYC questionnaire (including, but not limited to information of Beneficial Owners, shareholders, managers, legal entity type (form), name, legal status, main activity, address, financial standing, website, clients) come into force;\n\n13.4.3. in order to prevent money laundering and terrorist financing, the Customer fails to provide documents and/or information requested by the Company, or provides information or documents that do not comply with legal requirements or there are reasonable doubts whether documents and/or information provided by the Customer are true, accurate and complete;\n\n13.4.4. the Customer fails to provide evidence and/or documents proving the legal basis and/or origin of the funds or other assets, or there are other circumstances that suggest that the Customer is involved in money laundering and/or terrorist financing;\n\n13.4.5. the Customer's business risk level changes and can no longer be considered acceptable to the Company;\n\n13.4.6. the Customer breaches or the Company has grounds to reasonably suspect that the Customer may be in breach of any Applicable Law requirements and the Company provides written proof of the reasonable grounds for such suspicion;\n\n13.4.7. the Customer engages or the Company has grounds to reasonably suspect that the Customer may be engaged in prohibited activities set forth in Clause 5.1.15 of this Agreement and the Company provides written proof of the reasonable grounds for such suspicion;\n\n13.4.8. the Customer's activity is likely to harm the Company's or third parties justified interests or business reputation;\n\n13.4.9. the Company is required to do so by the Applicable Law or financial regulator of the Company;\n\n13.4.10. the Customer and/or natural person related to the Customer and/or any of their managers, employees, representatives, Beneficial Owners that are:\n\n(a) listed on any Sanctions list or targeted by Sanctions (whether designated by name or by reason of being included in a class of person); or\n\n(b) located in or incorporated under the laws of any country or territory that is the target of Sanctions; or\n\n(c) directly or indirectly owned or controlled by, or acting on behalf of, at the direction or for the benefit of, a person referred to in (a) above and/or to the extent relevant under (b) above.\n\n13.4.11. the Company would be prohibited or restricted by Sanctions from transacting or dealing with (including but not limited to entering into an Agreement) or otherwise exercising any rights in respect of, or fulfilling any duties or obligations owed to such a person;\n\n13.4.12. the Customer and/or natural person related to the Customer and/or any of their managers, employees, representatives, Beneficial Owners are subject to a complaint, claim, inspection, case or investigation relating to any Sanctions imposed by any supervisory or law enforcement authority or third party.\n\n13.5. The Company has the right to unilaterally terminate this Agreement and suspend the provision of the Services of the following measures indicated in Clause 13.4. with immediate effect and notify the Customer in writing thereof.\n\n13.6. Upon termination of this Agreement of the following measures indicated in Clause 13.4., the Company is not liable for losses incurred by the Customer due to suspension of Service provision. The Customer confirms and clearly understands the consequences of failing to comply with legal obligations.\n\n13.7. The provisions of the Agreement on confidentiality mutual settlement and other obligations of the Parties arising prior to the termination of the Agreement shall survive termination or expiration of this Agreement until such time as the Customer has settled with the Company and duly fulfilled other obligations under the Agreement.\n\n13.8. Upon termination of the Agreement, the Customer shall immediately remove all information related to the Services on the relevant Customer's Website.\n\n13.9. The Parties hereby agree that in case of any termination/expiration of the Agreement or suspension of obligations hereunder, the Parties shall arrange the final settlement of their monetary obligations within 10 business days.\n\n---\n\n## 14. DISPUTE RESOLUTION AND GOVERNING LAW\n\n14.1. Any controversy or dispute arising between the Parties in connection with this Agreement shall be resolved amicably by the Parties. Failing that, all disputes, controversies or claims arising out of or related to this Agreement, its breach, termination or validity shall be resolved by a competent court in London, England.\n\n14.2. This Agreement shall be governed by and interpreted in accordance with the law of England and Wales.\n\n---\n\n## 15. NOTICES\n\n15.1. Any and all notices, approvals and other communications that may be made or given by a Party under this Agreement shall be deemed valid if delivered to the other Party in person with acknowledgement of receipt or sent by registered mail or e-mail at the respective address specified in the Special Conditions or such other address as either Party may notify to the other.\n\n---\n\n## 16. FINAL PROVISIONS\n\n16.1. The Party shall not be entitled to assign its rights and obligations under this Agreement, either in whole or in part, to any third party without the prior written consent of the other Party.\n\n16.2. The Parties confirm that they have read the Agreement thoroughly and understand its content and are prepared to assume the General rights and obligations set out in the Agreement.\n\n16.3. All title and copyright, trademarks and service marks, patents and all other intellectual property rights related to the Services shall belong to the Company.\n\n16.4. If any provision of this Agreement is or becomes invalid, either in full or in part, this shall not render invalid the remaining provisions of this Agreement. In that case the Parties shall agree to conclude as promptly as possible an additional arrangement or agreement replacing the invalid provisions of this Agreement with legally enforceable provisions which, to the extent possible, have the same economic and legal effect as the original provision of the Agreement that has become invalid.\n\n---\n\n## SIGNATURES\n\n**On behalf of the Company:**\n\nYuliia NIKULINA (Director)\n\nSignature: _____________________\n\n---\n\n**On behalf of the Customer:**\n\nVitalijs Lomako (Director)\n\nSignature: _____________________\n\n---\n\n**Docusign Envelope ID:** 53CD6408-167F-4258-B569-EB954104BE9E\n\n---\n\n---\n\n# SERVICES AGREEMENT - SPECIAL CONDITIONS\n\n**London \u00ab01\u00bb October 2025**\n\n---\n\n## 1. Parties\n\n### 1.1. Company\n\n| Field | Value |\n|-------|-------|\n| Name of legal entity | FINTHESIS LTD |\n| Registration number | 12431685 |\n| Address | 2-4 Eastern Road, Imperial Offices, Romford, England, RM1 3PJ |\n| Address for correspondence | 2-4 Eastern Road, Imperial Offices, Romford, England, RM1 3PJ |\n| Tel. | +44 7308 698161 |\n| E-mail | yn@paio.company |\n| Name, surname and position of representative | Yuliia NIKULINA; Director/CEO |\n| Ground for representation | Articles of Association of the Company |\n\n### 1.2. Customer\n\n| Field | Value |\n|-------|-------|\n| Name of legal entity | WEBNORUS LIMITED |\n| Legal entity code | 15668312 |\n| VAT number | - |\n| Registered office address | 33 St. Leonards Road, Hull, England HU5 1BE |\n| Address for correspondence | Oakdale Road, Tower Court, YORK, North Yorkshire, United Kingdom YO30 4XL |\n| Tel. | +37126659375 |\n| E-mail | general@ninja-skins.com |\n| Bank account | Financial Institution name THE 3ROOKS MONEY S.P.A<br>Account No.IBAN SM05O189990980000EEX1110028<br>BIC/SWIFT RMOESMS2XXX<br>Account holder Webnorus Limited |\n| Respondent Websites | https://ninja-skins.com/ |\n| Name, surname and position of representative | Vitalijs Lomako, Director |\n\n---\n\n## 2. Price of Services and Payment Terms\n\n### 2.1. Price of Services\n\n| Service | Fee |\n|---------|-----|\n| BLIK T&C | 2.5% + 0.1 EUR per transaction |\n| Refund Cost | 5 EUR per transaction |\n| Decline | 0.1 EUR per transaction |\n| RR | 10% for 180 days (cap 30000 EUR) |\n\nThe Price of Services is stated exclusive of the value added tax, which, if applicable, shall be paid in addition as required by law.\n\n### 2.2. Payment terms\n\nThe Company will deduct the Price of Services from the amount of the Settlements. The Settlement will be paid on the next Business Day for the previous Business Day during which the Settlements were collected by the Company.\n\n---\n\n## 3. Amendments to the General Conditions\n\nNone\n\n---\n\n## 4. Other Special Conditions\n\n**Method:** (ii) the Company provides the Services of collection the funds from the Customer's Clients and/or Persons through the Payment Initiation Service provided by the Company, and their further repayment to the Customer.\n\n**Limit for transaction:** EUR 1,000.00 (one thousand euro)\n\n---\n\n## 5. Annexes to the Agreement\n\n| Applicable | No | Title of the Annex |\n|------------|----|--------------------|\n| X | 1 | SERVICES AGREEMENT GENERAL TERMS AND CONDITIONS No2501-10/OB DD \u00ab01\u00bb OCTOBER 2025 |\n\nThe Parties confirm that they have negotiated and agreed on the Special Conditions, that all make this entire Agreement.\n\n---\n\n## 6. Signatures of the Parties\n\n6.1. The Parties confirm that all terms and conditions of the Agreement have been individually discussed by the Parties, are understandable and correspond to the real will of the Parties.\n\n**On behalf of the Company:**\n\nYuliia NIKULINA (Director)\n\nSignature: _____________________\n\n---\n\n**On behalf of the Customer:**\n\nVitalijs Lomako (Director)\n\nSignature: _____________________\n\n---\n\n---\n\n## Document Information\n\n| Field | Value |\n|-------|-------|\n| Document Type | Payment Management Services Agreement + BLIK Services Agreement |\n| Main Contract | PAYMENT MANAGEMENT SERVICES AGREEMENT NO 0209-25 |\n| Main Contract Date | 02.09.2025 |\n| BLIK Agreement | SERVICES AGREEMENT No 25/01-10/OB |\n| BLIK Agreement Date | 01.10.2025 |\n| Main Provider | SMARTFLOW PAYMENTS LIMITED |\n| Main Provider Registration | 11070048 |\n| Main Provider Address | Office 39.18, Level39, One Canada Square, London, E14 5AB |\n| BLIK Provider | FINTHESIS LTD |\n| BLIK Provider Registration | 12431685 |\n| BLIK Provider FCA Number | 924263 |\n| BLIK Provider Address | 2-4 Eastern Road, Imperial Offices, Romford, England, RM1 3PJ |\n| Merchant | WEBNORUS LIMITED |\n| Merchant Registration | 15668312 |\n| Merchant Address | 33 St. Leonards Road, Hull, England, HU5 1BE |\n| MCC | 5816 |\n| URL | https://ninja-skins.com/ |\n| Docusign Envelope ID | 53CD6408-167F-4258-B569-EB954104BE9E |\n\n---\n\n## Fee Summary\n\n| Payment Type | Currency | Region | Rate | Fixed Fee | Refund Fee | Chargeback Fee | Source |\n|--------------|----------|--------|------|-----------|------------|----------------|--------|\n| Card | EUR | EU | 3.8% | 0.0 | 5.0 EUR | 50.0 EUR | SMARTFLOW 0209-25 |\n| Card | EUR | UK | 3.8% | 0.0 | 5.0 EUR | 50.0 EUR | SMARTFLOW 0209-25 |\n| Card | GBP | EU | 3.8% | 0.0 | 5.0 EUR | 50.0 EUR | SMARTFLOW 0209-25 |\n| Card | GBP | UK | 3.8% | 0.0 | 5.0 EUR | 50.0 EUR | SMARTFLOW 0209-25 |\n| Apple Pay | EUR | EU | 3.8% | 0.0 | 5.0 EUR | 50.0 EUR | SMARTFLOW 0209-25 |\n| Apple Pay | EUR | UK | 3.8% | 0.0 | 5.0 EUR | 50.0 EUR | SMARTFLOW 0209-25 |\n| Apple Pay | GBP | EU | 3.8% | 0.0 | 5.0 EUR | 50.0 EUR | SMARTFLOW 0209-25 |\n| Apple Pay | GBP | UK | 3.8% | 0.0 | 5.0 EUR | 50.0 EUR | SMARTFLOW 0209-25 |\n| Google Pay | EUR | EU | 3.8% | 0.0 | 5.0 EUR | 50.0 EUR | SMARTFLOW 0209-25 |\n| Google Pay | EUR | UK | 3.8% | 0.0 | 5.0 EUR | 50.0 EUR | SMARTFLOW 0209-25 |\n| Google Pay | GBP | EU | 3.8% | 0.0 | 5.0 EUR | 50.0 EUR | SMARTFLOW 0209-25 |\n| Google Pay | GBP | UK | 3.8% | 0.0 | 5.0 EUR | 50.0 EUR | SMARTFLOW 0209-25 |\n| BLIK | PLN | EU | 2.5% | 0.1 EUR | 5.0 EUR | N/A | FINTHESIS 25/01-10/OB |\n\n**Rolling Reserve (SMARTFLOW):** 10% for 180 days, cap 37,500 EUR\n**Rolling Reserve (BLIK):** 10% for 180 days, cap 30,000 EUR\n\n```",
  "plan": {
    "contract_id": "0209-25",
    "company_name": "WEBNORUS LIMITED",
    "company_address": "33 St. Leonards Road, Hull, England, HU5 1BE",
    "company_registration_number": "15668312",
    "provider_name": "SMARTFLOW PAYMENTS LIMITED",
    "provider_registration_number": "11070048",
    "provider_address": "Office 39.18, Level39, One Canada Square, London, England, E14 5AB",
    "secondary_provider": {
      "name": "FINTHESIS LTD",
      "registration_number": "12431685",
      "fca_number": "924263",
      "address": "2-4 Eastern Road, Imperial Offices, Romford, England, RM1 3PJ",
      "service": "BLIK Payment Initiation Services",
      "contract_id": "25/01-10/OB",
      "contract_date": "2025-10-01"
    },
    "contract_date": "2025-09-02",
    "addendum_date": "2025-09-02",
    "contract_expiry": null,
    "term": "Indefinite (30 days notice to terminate)",
    "governing_law": "England and Wales",
    "mcc": "5816",
    "urls": [
      "https://ninja-skins.com/"
    ],
    "settlement_currency": "EUR",
    "rolling_reserve": {
      "percent": 10.0,
      "hold_days": 180,
      "cap_eur": 37500.0
    },
    "blik_rolling_reserve": {
      "percent": 10.0,
      "hold_days": 180,
      "cap_eur": 30000.0
    },
    "fees": [
      {
        "operation_type": "incoming",
        "payment_type": "card",
        "apm_type": null,
        "currency": "EUR",
        "currency_type": "fiat",
        "region": "EU",
        "volume_min": null,
        "volume_max": null,
        "wl_percent": 3.8,
        "payout_percent": null,
        "fixed_fee": 0.0,
        "refund_fee": 5.0,
        "chb_fee": 50.0,
        "exchange_fee_percent": null,
        "source": "Contract 0209-25, Terms of Business Agreement Addendum",
        "contract_ref": "0209-25:incoming:card:EUR:EU"
      },
      {
        "operation_type": "incoming",
        "payment_type": "card",
        "apm_type": null,
        "currency": "EUR",
        "currency_type": "fiat",
        "region": "UK",
        "volume_min": null,
        "volume_max": null,
        "wl_percent": 3.8,
        "payout_percent": null,
        "fixed_fee": 0.0,
        "refund_fee": 5.0,
        "chb_fee": 50.0,
        "exchange_fee_percent": null,
        "source": "Contract 0209-25, Terms of Business Agreement Addendum",
        "contract_ref": "0209-25:incoming:card:EUR:UK"
      },
      {
        "operation_type": "incoming",
        "payment_type": "card",
        "apm_type": null,
        "currency": "GBP",
        "currency_type": "fiat",
        "region": "EU",
        "volume_min": null,
        "volume_max": null,
        "wl_percent": 3.8,
        "payout_percent": null,
        "fixed_fee": 0.0,
        "refund_fee": 5.0,
        "chb_fee": 50.0,
        "exchange_fee_percent": null,
        "source": "Contract 0209-25, Terms of Business Agreement Addendum",
        "contract_ref": "0209-25:incoming:card:GBP:EU"
      },
      {
        "operation_type": "incoming",
        "payment_type": "card",
        "apm_type": null,
        "currency": "GBP",
        "currency_type": "fiat",
        "region": "UK",
        "volume_min": null,
        "volume_max": null,
        "wl_percent": 3.8,
        "payout_percent": null,
        "fixed_fee": 0.0,
        "refund_fee": 5.0,
        "chb_fee": 50.0,
        "exchange_fee_percent": null,
        "source": "Contract 0209-25, Terms of Business Agreement Addendum",
        "contract_ref": "0209-25:incoming:card:GBP:UK"
      },
      {
        "operation_type": "incoming",
        "payment_type": "apm",
        "apm_type": "apple_pay",
        "currency": "EUR",
        "currency_type": "fiat",
        "region": "EU",
        "volume_min": null,
        "volume_max": null,
        "wl_percent": 3.8,
        "payout_percent": null,
        "fixed_fee": 0.0,
        "refund_fee": 5.0,
        "chb_fee": 50.0,
        "exchange_fee_percent": null,
        "source": "Contract 0209-25, Terms of Business Agreement Addendum",
        "contract_ref": "0209-25:incoming:apm:apple_pay:EUR:EU"
      },
      {
        "operation_type": "incoming",
        "payment_type": "apm",
        "apm_type": "apple_pay",
        "currency": "EUR",
        "currency_type": "fiat",
        "region": "UK",
        "volume_min": null,
        "volume_max": null,
        "wl_percent": 3.8,
        "payout_percent": null,
        "fixed_fee": 0.0,
        "refund_fee": 5.0,
        "chb_fee": 50.0,
        "exchange_fee_percent": null,
        "source": "Contract 0209-25, Terms of Business Agreement Addendum",
        "contract_ref": "0209-25:incoming:apm:apple_pay:EUR:UK"
      },
      {
        "operation_type": "incoming",
        "payment_type": "apm",
        "apm_type": "apple_pay",
        "currency": "GBP",
        "currency_type": "fiat",
        "region": "EU",
        "volume_min": null,
        "volume_max": null,
        "wl_percent": 3.8,
        "payout_percent": null,
        "fixed_fee": 0.0,
        "refund_fee": 5.0,
        "chb_fee": 50.0,
        "exchange_fee_percent": null,
        "source": "Contract 0209-25, Terms of Business Agreement Addendum",
        "contract_ref": "0209-25:incoming:apm:apple_pay:GBP:EU"
      },
      {
        "operation_type": "incoming",
        "payment_type": "apm",
        "apm_type": "apple_pay",
        "currency": "GBP",
        "currency_type": "fiat",
        "region": "UK",
        "volume_min": null,
        "volume_max": null,
        "wl_percent": 3.8,
        "payout_percent": null,
        "fixed_fee": 0.0,
        "refund_fee": 5.0,
        "chb_fee": 50.0,
        "exchange_fee_percent": null,
        "source": "Contract 0209-25, Terms of Business Agreement Addendum",
        "contract_ref": "0209-25:incoming:apm:apple_pay:GBP:UK"
      },
      {
        "operation_type": "incoming",
        "payment_type": "apm",
        "apm_type": "google_pay",
        "currency": "EUR",
        "currency_type": "fiat",
        "region": "EU",
        "volume_min": null,
        "volume_max": null,
        "wl_percent": 3.8,
        "payout_percent": null,
        "fixed_fee": 0.0,
        "refund_fee": 5.0,
        "chb_fee": 50.0,
        "exchange_fee_percent": null,
        "source": "Contract 0209-25, Terms of Business Agreement Addendum",
        "contract_ref": "0209-25:incoming:apm:google_pay:EUR:EU"
      },
      {
        "operation_type": "incoming",
        "payment_type": "apm",
        "apm_type": "google_pay",
        "currency": "EUR",
        "currency_type": "fiat",
        "region": "UK",
        "volume_min": null,
        "volume_max": null,
        "wl_percent": 3.8,
        "payout_percent": null,
        "fixed_fee": 0.0,
        "refund_fee": 5.0,
        "chb_fee": 50.0,
        "exchange_fee_percent": null,
        "source": "Contract 0209-25, Terms of Business Agreement Addendum",
        "contract_ref": "0209-25:incoming:apm:google_pay:EUR:UK"
      },
      {
        "operation_type": "incoming",
        "payment_type": "apm",
        "apm_type": "google_pay",
        "currency": "GBP",
        "currency_type": "fiat",
        "region": "EU",
        "volume_min": null,
        "volume_max": null,
        "wl_percent": 3.8,
        "payout_percent": null,
        "fixed_fee": 0.0,
        "refund_fee": 5.0,
        "chb_fee": 50.0,
        "exchange_fee_percent": null,
        "source": "Contract 0209-25, Terms of Business Agreement Addendum",
        "contract_ref": "0209-25:incoming:apm:google_pay:GBP:EU"
      },
      {
        "operation_type": "incoming",
        "payment_type": "apm",
        "apm_type": "google_pay",
        "currency": "GBP",
        "currency_type": "fiat",
        "region": "UK",
        "volume_min": null,
        "volume_max": null,
        "wl_percent": 3.8,
        "payout_percent": null,
        "fixed_fee": 0.0,
        "refund_fee": 5.0,
        "chb_fee": 50.0,
        "exchange_fee_percent": null,
        "source": "Contract 0209-25, Terms of Business Agreement Addendum",
        "contract_ref": "0209-25:incoming:apm:google_pay:GBP:UK"
      },
      {
        "operation_type": "incoming",
        "payment_type": "apm",
        "apm_type": "blik",
        "currency": "PLN",
        "currency_type": "fiat",
        "region": "EU",
        "volume_min": null,
        "volume_max": null,
        "wl_percent": 2.5,
        "payout_percent": null,
        "fixed_fee": 0.1,
        "refund_fee": 5.0,
        "chb_fee": null,
        "exchange_fee_percent": null,
        "source": "FINTHESIS LTD Services Agreement 25/01-10/OB, Special Conditions",
        "contract_ref": "25/01-10/OB:incoming:apm:blik:PLN:EU"
      }
    ],
    "settlement_accounts": {
      "merchant": {
        "account_holder": "Webnorus Limited",
        "iban": "SM050189990980000EEX1110028",
        "bic": "RMOESMS2XXX",
        "bank_name": "THE 3ROOKS MONEY S.P.A",
        "bank_address": "VIA MONALDO DA FALCIANO 6"
      },
      "provider": [
        {
          "account_holder": "SMARTFLOW PAYMENTS LIMITED",
          "iban": "CH6308843243421270710",
          "bic": "DUBACHGGXXX",
          "bank_name": "Dukascopy Bank SA",
          "bank_address": "Route de Pr\u00e9-Bois 20, Gen\u00e8ve 1215, Switzerland (CH)"
        },
        {
          "account_holder": "SMARTFLOW PAYMENTS LIMITED",
          "iban": "LT463880010100316908",
          "bic": "GLUALT22XXX",
          "bank_name": "Payswix, UAB",
          "bank_address": "Lvovo g. 25-104, LT-09320 Vilnius, Lithuania"
        }
      ]
    },
    "contacts": {
      "merchant": {
        "name": "Vitalijs Lomako",
        "email": "business@ninja-skins.com",
        "phone": "+37126659375"
      },
      "provider": {
        "name": "Anastasiia Pervushyna",
        "email": "apa@sends.co"
      },
      "blik_provider": {
        "name": "Yuliia Nikulina",
        "email": "yn@paio.company",
        "phone": "+44 7308 698161"
      }
    }
  }
}